{
  "schemaVersion": 1,
  "action": "doctor",
  "recordedAtUtc": "2026-09-07T01:34:41.639910+00:00",
  "result": "pass",
  "sourceRevision": "d685f85ab698415801ea2595fa6050066bbb4844",
  "environment": {
    "os": "Windows",
    "python": "3.12.14",
    "unityVersion": "6000.3.23f1"
  },
  "checks": [
    {
      "id": "python",
      "result": "pass",
      "message": "3.12.14",
      "details": {}
    },
    {
      "id": "unity-installation",
      "result": "pass",
      "message": "6000.3.23f1",
      "details": {}
    },
    {
      "id": "plan",
      "result": "pass",
      "message": "exit 0",
      "details": {
        "command": [
          "C:\\Users\\cadet\\.cache\\codex-runtimes\\codex-primary-runtime\\dependencies\\python\\python.exe",
          "-X",
          "utf8",
          "tools/plan/build_plan.py",
          "--check"
        ],
        "output": "diagnostics/doctor-plan.log"
      }
    },
    {
      "id": "progress",
      "result": "pass",
      "message": "exit 0",
      "details": {
        "command": [
          "C:\\Users\\cadet\\.cache\\codex-runtimes\\codex-primary-runtime\\dependencies\\python\\python.exe",
          "-X",
          "utf8",
          "tools/progress/validate.py"
        ],
        "output": "diagnostics/doctor-progress.log"
      }
    },
    {
      "id": "staging",
      "result": "pass",
      "message": "Generated configuration matches source",
      "details": {}
    },
    {
      "id": "unity-project",
      "result": "deferred",
      "message": "Unity project creation/import is a later bootstrap step",
      "details": {}
    }
  ],
  "limitations": [
    "Development diagnostics only; no physical, safety or gate acceptance."
  ]
}
