{
  "schemaVersion": 1,
  "action": "test",
  "recordedAtUtc": "2026-09-07T01:34:44.257331+00:00",
  "result": "fail",
  "sourceRevision": "d685f85ab698415801ea2595fa6050066bbb4844",
  "environment": {
    "os": "Windows",
    "python": "3.12.14",
    "unityVersion": "6000.3.23f1"
  },
  "checks": [
    {
      "id": "python",
      "result": "pass",
      "message": "3.12.14",
      "details": {}
    },
    {
      "id": "unity-installation",
      "result": "pass",
      "message": "6000.3.23f1",
      "details": {}
    },
    {
      "id": "plan",
      "result": "pass",
      "message": "exit 0",
      "details": {
        "command": [
          "C:\\Users\\cadet\\.cache\\codex-runtimes\\codex-primary-runtime\\dependencies\\python\\python.exe",
          "-X",
          "utf8",
          "-m",
          "unittest",
          "discover",
          "-s",
          "tools/plan",
          "-p",
          "test_*.py",
          "-v"
        ],
        "output": "diagnostics/test-plan.log"
      }
    },
    {
      "id": "progress",
      "result": "pass",
      "message": "exit 0",
      "details": {
        "command": [
          "C:\\Users\\cadet\\.cache\\codex-runtimes\\codex-primary-runtime\\dependencies\\python\\python.exe",
          "-X",
          "utf8",
          "-m",
          "unittest",
          "discover",
          "-s",
          "tools/progress",
          "-p",
          "test_*.py",
          "-v"
        ],
        "output": "diagnostics/test-progress.log"
      }
    },
    {
      "id": "config",
      "result": "fail",
      "message": "exit 1",
      "details": {
        "command": [
          "C:\\Users\\cadet\\.cache\\codex-runtimes\\codex-primary-runtime\\dependencies\\python\\python.exe",
          "-X",
          "utf8",
          "-m",
          "unittest",
          "discover",
          "-s",
          "tools/config",
          "-p",
          "test_*.py",
          "-v"
        ],
        "output": "diagnostics/test-config.log"
      }
    },
    {
      "id": "failure",
      "result": "fail",
      "message": "config failed; inspect diagnostics\\test-config.log",
      "details": {
        "remediation": "Reconcile the stated input/check, preserve diagnostics, and rerun. Do not change progress manually."
      }
    }
  ],
  "limitations": [
    "Development diagnostics only; no physical, safety or gate acceptance."
  ]
}
