{
  "schemaVersion": 1,
  "action": "package-study",
  "recordedAtUtc": "2026-09-07T01:34:09.671423+00:00",
  "result": "fail",
  "sourceRevision": "259861f800a82465f0415663edb6cbc8e502c33a",
  "environment": {
    "os": "Windows",
    "python": "3.12.14",
    "unityVersion": "6000.3.23f1"
  },
  "checks": [
    {
      "id": "python",
      "result": "pass",
      "message": "3.12.14",
      "details": {}
    },
    {
      "id": "unity-installation",
      "result": "pass",
      "message": "6000.3.23f1",
      "details": {}
    },
    {
      "id": "failure",
      "result": "fail",
      "message": "Study provisioning/packaging is unavailable: approved study configuration, physical acceptance and release gates remain pending. Use development instructions.",
      "details": {
        "remediation": "Reconcile the stated input/check, preserve diagnostics, and rerun. Do not change progress manually."
      }
    }
  ],
  "limitations": [
    "Development diagnostics only; no physical, safety or gate acceptance."
  ]
}
